{
  "version": 1,
  "policy_version": "source-v1",
  "root_directory": "",
  "entries": [
    {
      "path": "README.md",
      "type": "file",
      "mode": 420,
      "size": 6,
      "sha256": "sha256:5891b5b522d5df086d0ff0b110fbd9d21bb4fc7163af34d08286a2e846f6be03"
    }
  ],
  "included_count": 1,
  "included_bytes": 6,
  "excluded_count": 0,
  "warnings": [],
  "scan": {
    "status": "passed",
    "findings": []
  }
}
